{
  "activity_id": "0191f7b4-3f2a-7c1d-9e88-2b6a5d4c3e91",
  "correlation_id": "0191f7b4-3f2a-7c1d-9e88-2b6a5d4c3e01",
  "delegation_chain": [],
  "event_id": "0191f7b4-3f2a-7c1d-9e88-2b6a5d4c3e15",
  "event_type": "decision.record",
  "occurred_at": "2026-07-26T12:00:15.000Z",
  "payload": {
    "activity_id": "0191f7b4-3f2a-7c1d-9e88-2b6a5d4c3e91",
    "agent_id": "0191f7b4-3f2a-7c1d-9e88-2b6a5d4c3e92",
    "decision_id": "0191f7b4-3f2a-7c1d-9e88-2b6a5d4c3e80",
    "evidence": [
      {
        "kind": "event",
        "reference": "0191f7b4-3f2a-7c1d-9e88-2b6a5d4c3e11"
      },
      {
        "digest": "sha256:efefefefefefefefefefefefefefefefefefefefefefefefefefefefefefefef",
        "kind": "artifact",
        "reference": "artifact://plan/1"
      }
    ],
    "statement": "Adopt JetStream work queues for commands."
  },
  "protocol_version": "1.0",
  "sequence": 15,
  "signature": "AAAAAAAAAAAAAAAAAAAAAAAAAAAAAAAAAAAAAAAAAAAAAAAAAAAAAAAAAAAAAAAAAAAAAAAAAAAAAAAAAAAAAA",
  "signer_key_id": "NYM5RLRJB6K2BD5REZ2WX75HDVULXAW5BAYJR6F3CLVOYDN37QZQ",
  "source_agent_id": "0191f7b4-3f2a-7c1d-9e88-2b6a5d4c3e92",
  "tenant_id": "acme",
  "thread_id": "0191f7b4-3f2a-7c1d-9e88-2b6a5d4c3e90",
  "trust_domain": "tenant",
  "workspace_id": "platform"
}
