{
  "activity_id": "0191f7b4-3f2a-7c1d-9e88-2b6a5d4c3e91",
  "correlation_id": "0191f7b4-3f2a-7c1d-9e88-2b6a5d4c3e01",
  "delegation_chain": [],
  "event_id": "0191f7b4-3f2a-7c1d-9e88-2b6a5d4c3e33",
  "event_type": "tool.call",
  "occurred_at": "2026-07-26T12:00:33.000Z",
  "payload": {
    "activity_id": "0191f7b4-3f2a-7c1d-9e88-2b6a5d4c3e91",
    "agent_id": "0191f7b4-3f2a-7c1d-9e88-2b6a5d4c3e92",
    "call_id": "0191f7b4-3f2a-7c1d-9e88-2b6a5d4c3e88",
    "target": {
      "kind": "url",
      "reference": "https://api.example.com/v1/deployments"
    },
    "tool_name": "http_request"
  },
  "protocol_version": "1.1",
  "sequence": 33,
  "signature": "AAAAAAAAAAAAAAAAAAAAAAAAAAAAAAAAAAAAAAAAAAAAAAAAAAAAAAAAAAAAAAAAAAAAAAAAAAAAAAAAAAAAAA",
  "signer_key_id": "NYM5RLRJB6K2BD5REZ2WX75HDVULXAW5BAYJR6F3CLVOYDN37QZQ",
  "source_agent_id": "0191f7b4-3f2a-7c1d-9e88-2b6a5d4c3e92",
  "tenant_id": "acme",
  "thread_id": "0191f7b4-3f2a-7c1d-9e88-2b6a5d4c3e90",
  "trust_domain": "tenant",
  "workspace_id": "platform"
}
