{
  "activity_id": "0191f7b4-3f2a-7c1d-9e88-2b6a5d4c3e91",
  "causation_id": "0191f7b4-3f2a-7c1d-9e88-2b6a5d4c3e11",
  "correlation_id": "0191f7b4-3f2a-7c1d-9e88-2b6a5d4c3e01",
  "definition_digest": "sha256:abababababababababababababababababababababababababababababababab",
  "delegation_chain": [],
  "event_id": "0191f7b4-3f2a-7c1d-9e88-2b6a5d4c3e12",
  "event_type": "chat.message",
  "occurred_at": "2026-07-26T12:00:12.000Z",
  "payload": {
    "agent_id": "0191f7b4-3f2a-7c1d-9e88-2b6a5d4c3e92",
    "role": "agent",
    "text": "Release notes drafted."
  },
  "protocol_version": "1.0",
  "sequence": 12,
  "signature": "AAAAAAAAAAAAAAAAAAAAAAAAAAAAAAAAAAAAAAAAAAAAAAAAAAAAAAAAAAAAAAAAAAAAAAAAAAAAAAAAAAAAAA",
  "signer_key_id": "NYM5RLRJB6K2BD5REZ2WX75HDVULXAW5BAYJR6F3CLVOYDN37QZQ",
  "source_agent_id": "0191f7b4-3f2a-7c1d-9e88-2b6a5d4c3e92",
  "tenant_id": "acme",
  "thread_id": "0191f7b4-3f2a-7c1d-9e88-2b6a5d4c3e90",
  "trust_domain": "tenant",
  "workspace_id": "platform"
}
