{
  "correlation_id": "0191f7b4-3f2a-7c1d-9e88-2b6a5d4c3e03",
  "delegation_chain": [],
  "destination_conductor_id": "0191f7b4-3f2a-7c1d-9e88-2b6a5d4c3e93",
  "event_id": "0191f7b4-3f2a-7c1d-9e88-2b6a5d4c3f60",
  "event_type": "query.request",
  "occurred_at": "2026-07-26T12:01:00.000Z",
  "payload": {
    "kind": "client.self",
    "query_id": "0191f7b4-3f2a-7c1d-9e88-2b6a5d4c3f90"
  },
  "protocol_version": "1.6",
  "sequence": 60,
  "signature": "AAAAAAAAAAAAAAAAAAAAAAAAAAAAAAAAAAAAAAAAAAAAAAAAAAAAAAAAAAAAAAAAAAAAAAAAAAAAAAAAAAAAAA",
  "signer_key_id": "NYM5RLRJB6K2BD5REZ2WX75HDVULXAW5BAYJR6F3CLVOYDN37QZQ",
  "tenant_id": "acme",
  "trust_domain": "tenant",
  "workspace_id": "platform"
}
