{
  "causation_id": "0191f7b4-3f2a-7c1d-9e88-2b6a5d4c3f62",
  "conductor_epoch": 4,
  "correlation_id": "0191f7b4-3f2a-7c1d-9e88-2b6a5d4c3e03",
  "delegation_chain": [],
  "event_id": "0191f7b4-3f2a-7c1d-9e88-2b6a5d4c3f63",
  "event_type": "query.result",
  "occurred_at": "2026-07-26T12:01:03.000Z",
  "payload": {
    "client": {
      "key_id": "NYM5RLRJB6K2BD5REZ2WX75HDVULXAW5BAYJR6F3CLVOYDN37QZQ",
      "status": "withdrawn"
    },
    "kind": "client.self",
    "query_id": "0191f7b4-3f2a-7c1d-9e88-2b6a5d4c3f91",
    "status": "ok"
  },
  "protocol_version": "1.6",
  "sequence": 63,
  "signature": "AAAAAAAAAAAAAAAAAAAAAAAAAAAAAAAAAAAAAAAAAAAAAAAAAAAAAAAAAAAAAAAAAAAAAAAAAAAAAAAAAAAAAA",
  "signer_key_id": "NYM5RLRJB6K2BD5REZ2WX75HDVULXAW5BAYJR6F3CLVOYDN37QZQ",
  "source_conductor_id": "0191f7b4-3f2a-7c1d-9e88-2b6a5d4c3e93",
  "tenant_id": "acme",
  "trust_domain": "tenant",
  "workspace_id": "platform"
}
