{
  "causation_id": "0191f7b4-3f2a-7c1d-9e88-2b6a5d4c3f03",
  "conductor_epoch": 4,
  "correlation_id": "0191f7b4-3f2a-7c1d-9e88-2b6a5d4c3e05",
  "delegation_chain": [],
  "event_id": "0191f7b4-3f2a-7c1d-9e88-2b6a5d4c3f72",
  "event_type": "query.result",
  "occurred_at": "2026-07-26T12:01:12.000Z",
  "payload": {
    "kind": "thread.list",
    "limit": 25,
    "offset": 0,
    "query_id": "0191f7b4-3f2a-7c1d-9e88-2b6a5d4c3f95",
    "status": "ok",
    "threads": [
      {
        "created_at": "2026-07-26T12:00:10.000Z",
        "harness": "claude",
        "model": "claude-opus-5",
        "state": "idle",
        "thread_id": "0191f7b4-3f2a-7c1d-9e88-2b6a5d4c3e90",
        "updated_at": "2026-07-26T12:00:12.000Z"
      },
      {
        "created_at": "2026-07-26T12:00:20.000Z",
        "state": "created",
        "thread_id": "0191f7b4-3f2a-7c1d-9e88-2b6a5d4c3e91",
        "updated_at": "2026-07-26T12:00:20.000Z"
      }
    ],
    "total": 2
  },
  "protocol_version": "1.7",
  "sequence": 72,
  "signature": "AAAAAAAAAAAAAAAAAAAAAAAAAAAAAAAAAAAAAAAAAAAAAAAAAAAAAAAAAAAAAAAAAAAAAAAAAAAAAAAAAAAAAA",
  "signer_key_id": "NYM5RLRJB6K2BD5REZ2WX75HDVULXAW5BAYJR6F3CLVOYDN37QZQ",
  "source_conductor_id": "0191f7b4-3f2a-7c1d-9e88-2b6a5d4c3e93",
  "tenant_id": "acme",
  "trust_domain": "tenant",
  "workspace_id": "platform"
}
