{
  "causation_id": "0191f7b4-3f2a-7c1d-9e88-2b6a5d4c3f02",
  "conductor_epoch": 4,
  "correlation_id": "0191f7b4-3f2a-7c1d-9e88-2b6a5d4c3e02",
  "delegation_chain": [],
  "event_id": "0191f7b4-3f2a-7c1d-9e88-2b6a5d4c3f14",
  "event_type": "query.result",
  "occurred_at": "2026-07-26T12:00:45.000Z",
  "payload": {
    "kind": "status",
    "query_id": "0191f7b4-3f2a-7c1d-9e88-2b6a5d4c3f82",
    "runtime": {
      "epoch": 4,
      "harnesses": [
        {
          "name": "claude",
          "version": "2.0.44"
        }
      ],
      "started_at": "2026-07-26T11:58:00.000Z",
      "workspace_id": "platform"
    },
    "status": "ok"
  },
  "protocol_version": "1.5",
  "sequence": 45,
  "signature": "AAAAAAAAAAAAAAAAAAAAAAAAAAAAAAAAAAAAAAAAAAAAAAAAAAAAAAAAAAAAAAAAAAAAAAAAAAAAAAAAAAAAAA",
  "signer_key_id": "NYM5RLRJB6K2BD5REZ2WX75HDVULXAW5BAYJR6F3CLVOYDN37QZQ",
  "source_conductor_id": "0191f7b4-3f2a-7c1d-9e88-2b6a5d4c3e93",
  "tenant_id": "acme",
  "trust_domain": "tenant",
  "workspace_id": "platform"
}
