{
  "causation_id": "0191f7b4-3f2a-7c1d-9e88-2b6a5d4c3f60",
  "conductor_epoch": 4,
  "correlation_id": "0191f7b4-3f2a-7c1d-9e88-2b6a5d4c3e03",
  "delegation_chain": [],
  "event_id": "0191f7b4-3f2a-7c1d-9e88-2b6a5d4c3f61",
  "event_type": "query.result",
  "occurred_at": "2026-07-26T12:01:01.000Z",
  "payload": {
    "client": {
      "capabilities": [
        "interaction.resolve",
        "query.issue",
        "thread.write"
      ],
      "enrolled_at": "2026-07-20T09:14:00.000Z",
      "key_id": "NYM5RLRJB6K2BD5REZ2WX75HDVULXAW5BAYJR6F3CLVOYDN37QZQ",
      "name": "dex-laptop",
      "status": "accepted"
    },
    "kind": "client.self",
    "query_id": "0191f7b4-3f2a-7c1d-9e88-2b6a5d4c3f90",
    "status": "ok"
  },
  "protocol_version": "1.6",
  "sequence": 61,
  "signature": "AAAAAAAAAAAAAAAAAAAAAAAAAAAAAAAAAAAAAAAAAAAAAAAAAAAAAAAAAAAAAAAAAAAAAAAAAAAAAAAAAAAAAA",
  "signer_key_id": "NYM5RLRJB6K2BD5REZ2WX75HDVULXAW5BAYJR6F3CLVOYDN37QZQ",
  "source_conductor_id": "0191f7b4-3f2a-7c1d-9e88-2b6a5d4c3e93",
  "tenant_id": "acme",
  "trust_domain": "tenant",
  "workspace_id": "platform"
}
