{
  "conductor_epoch": 4,
  "correlation_id": "0191f7b4-3f2a-7c1d-9e88-2b6a5d4c3e01",
  "delegation_chain": [],
  "event_id": "0191f7b4-3f2a-7c1d-9e88-2b6a5d4c3e24",
  "event_type": "audit.incident",
  "occurred_at": "2026-07-26T12:00:24.000Z",
  "payload": {
    "detail": {
      "expected": 13,
      "observed": 15
    },
    "incident_id": "0191f7b4-3f2a-7c1d-9e88-2b6a5d4c3e85",
    "offending_event_id": "0191f7b4-3f2a-7c1d-9e88-2b6a5d4c3e12",
    "reason": "sequence_gap",
    "severity": "warning"
  },
  "protocol_version": "1.0",
  "sequence": 24,
  "signature": "AAAAAAAAAAAAAAAAAAAAAAAAAAAAAAAAAAAAAAAAAAAAAAAAAAAAAAAAAAAAAAAAAAAAAAAAAAAAAAAAAAAAAA",
  "signer_key_id": "NYM5RLRJB6K2BD5REZ2WX75HDVULXAW5BAYJR6F3CLVOYDN37QZQ",
  "source_conductor_id": "0191f7b4-3f2a-7c1d-9e88-2b6a5d4c3e93",
  "tenant_id": "acme",
  "trust_domain": "tenant",
  "workspace_id": "platform"
}
