{
  "activity_id": "0191f7b4-3f2a-7c1d-9e88-2b6a5d4c3e91",
  "causation_id": "0191f7b4-3f2a-7c1d-9e88-2b6a5d4c3e19",
  "correlation_id": "0191f7b4-3f2a-7c1d-9e88-2b6a5d4c3e01",
  "delegation_chain": [],
  "event_id": "0191f7b4-3f2a-7c1d-9e88-2b6a5d4c3e20",
  "event_type": "question.resolved",
  "occurred_at": "2026-07-26T12:00:20.000Z",
  "payload": {
    "actor": {
      "authenticated_at": "2026-07-26T12:00:15.000Z",
      "email": "dana@example.com",
      "user_id": "user-7"
    },
    "answer": "eu-west-1",
    "interaction_id": "0191f7b4-3f2a-7c1d-9e88-2b6a5d4c3e82",
    "resolution": "answered"
  },
  "protocol_version": "1.0",
  "sequence": 20,
  "signature": "AAAAAAAAAAAAAAAAAAAAAAAAAAAAAAAAAAAAAAAAAAAAAAAAAAAAAAAAAAAAAAAAAAAAAAAAAAAAAAAAAAAAAA",
  "signer_key_id": "NYM5RLRJB6K2BD5REZ2WX75HDVULXAW5BAYJR6F3CLVOYDN37QZQ",
  "tenant_id": "acme",
  "thread_id": "0191f7b4-3f2a-7c1d-9e88-2b6a5d4c3e90",
  "trust_domain": "saas-attested",
  "workspace_id": "platform"
}
