{
  "correlation_id": "0191f7b4-3f2a-7c1d-9e88-2b6a5d4c3e01",
  "delegation_chain": [],
  "event_id": "0191f7b4-3f2a-7c1d-9e88-2b6a5d4c3f81",
  "event_type": "agent.usage",
  "occurred_at": "2026-07-26T12:00:16.000Z",
  "payload": {
    "agent_id": "0191f7b4-3f2a-7c1d-9e88-2b6a5d4c3e92",
    "cache_read_tokens": 8192,
    "cache_write_1h_tokens": 0,
    "cache_write_5m_tokens": 1024,
    "cost_usd_micros": 31400,
    "input_tokens": 12400,
    "model": "claude-opus-5",
    "output_tokens": 1100
  },
  "protocol_version": "1.8",
  "sequence": 16,
  "signature": "AAAAAAAAAAAAAAAAAAAAAAAAAAAAAAAAAAAAAAAAAAAAAAAAAAAAAAAAAAAAAAAAAAAAAAAAAAAAAAAAAAAAAA",
  "signer_key_id": "NYM5RLRJB6K2BD5REZ2WX75HDVULXAW5BAYJR6F3CLVOYDN37QZQ",
  "source_agent_id": "0191f7b4-3f2a-7c1d-9e88-2b6a5d4c3e92",
  "tenant_id": "acme",
  "thread_id": "0191f7b4-3f2a-7c1d-9e88-2b6a5d4c3e90",
  "trust_domain": "tenant",
  "workspace_id": "platform"
}
