{
  "activity_id": "0191f7b4-3f2a-7c1d-9e88-2b6a5d4c3e91",
  "causation_id": "0191f7b4-3f2a-7c1d-9e88-2b6a5d4c3e33",
  "correlation_id": "0191f7b4-3f2a-7c1d-9e88-2b6a5d4c3e01",
  "delegation_chain": [],
  "event_id": "0191f7b4-3f2a-7c1d-9e88-2b6a5d4c3e34",
  "event_type": "tool.result",
  "occurred_at": "2026-07-26T12:00:34.000Z",
  "payload": {
    "call_id": "0191f7b4-3f2a-7c1d-9e88-2b6a5d4c3e88",
    "error": {
      "code": "permission_denied",
      "message": "the permission interaction expired unresolved and on_timeout is deny"
    },
    "outcome": "not_run"
  },
  "protocol_version": "1.1",
  "sequence": 34,
  "signature": "AAAAAAAAAAAAAAAAAAAAAAAAAAAAAAAAAAAAAAAAAAAAAAAAAAAAAAAAAAAAAAAAAAAAAAAAAAAAAAAAAAAAAA",
  "signer_key_id": "NYM5RLRJB6K2BD5REZ2WX75HDVULXAW5BAYJR6F3CLVOYDN37QZQ",
  "source_agent_id": "0191f7b4-3f2a-7c1d-9e88-2b6a5d4c3e92",
  "tenant_id": "acme",
  "thread_id": "0191f7b4-3f2a-7c1d-9e88-2b6a5d4c3e90",
  "trust_domain": "tenant",
  "workspace_id": "platform"
}
