{
  "activity_id": "0191f7b4-3f2a-7c1d-9e88-2b6a5d4c3e91",
  "causation_id": "0191f7b4-3f2a-7c1d-9e88-2b6a5d4c3e19",
  "correlation_id": "0191f7b4-3f2a-7c1d-9e88-2b6a5d4c3e02",
  "delegation_chain": [],
  "event_id": "0191f7b4-3f2a-7c1d-9e88-2b6a5d4c3e1a",
  "event_type": "permission.resolved",
  "occurred_at": "2026-07-26T12:00:19.000Z",
  "payload": {
    "actor": {
      "kind": "signing_key",
      "key_id": "A3SVWYZUQH33WBZJK7VLZ4IQZFZOQZURYPH63K7ARABEX77EF4RQ"
    },
    "interaction_id": "0191f7b4-3f2a-7c1d-9e88-2b6a5d4c3e82",
    "resolution": "allowed",
    "reason": "the operator authorised the retry"
  },
  "protocol_version": "1.2",
  "sequence": 19,
  "signature": "AAAAAAAAAAAAAAAAAAAAAAAAAAAAAAAAAAAAAAAAAAAAAAAAAAAAAAAAAAAAAAAAAAAAAAAAAAAAAAAAAAAAAA",
  "signer_key_id": "NYM5RLRJB6K2BD5REZ2WX75HDVULXAW5BAYJR6F3CLVOYDN37QZQ",
  "tenant_id": "acme",
  "thread_id": "0191f7b4-3f2a-7c1d-9e88-2b6a5d4c3e90",
  "trust_domain": "tenant",
  "workspace_id": "platform"
}
