{
  "correlation_id": "0191f7b4-3f2a-7c1d-9e88-2b6a5d4c3e04",
  "delegation_chain": [],
  "destination_conductor_id": "0191f7b4-3f2a-7c1d-9e88-2b6a5d4c3e93",
  "event_id": "0191f7b4-3f2a-7c1d-9e88-2b6a5d4c3f70",
  "event_type": "query.request",
  "occurred_at": "2026-07-26T12:01:10.000Z",
  "payload": {
    "kind": "harness.list",
    "query_id": "0191f7b4-3f2a-7c1d-9e88-2b6a5d4c3f94"
  },
  "protocol_version": "1.7",
  "sequence": 70,
  "signature": "AAAAAAAAAAAAAAAAAAAAAAAAAAAAAAAAAAAAAAAAAAAAAAAAAAAAAAAAAAAAAAAAAAAAAAAAAAAAAAAAAAAAAA",
  "signer_key_id": "NYM5RLRJB6K2BD5REZ2WX75HDVULXAW5BAYJR6F3CLVOYDN37QZQ",
  "tenant_id": "acme",
  "trust_domain": "saas-attested",
  "workspace_id": "platform"
}
