{
  "correlation_id": "0191f7b4-3f2a-7c1d-9e88-2b6a5d4c3e01",
  "delegation_chain": [],
  "destination_conductor_id": "0191f7b4-3f2a-7c1d-9e88-2b6a5d4c3e93",
  "event_id": "0191f7b4-3f2a-7c1d-9e88-2b6a5d4c3e21",
  "event_type": "command.requested",
  "occurred_at": "2026-07-26T12:00:21.000Z",
  "payload": {
    "actor": {
      "authenticated_at": "2026-07-26T12:00:20.000Z",
      "email": "dana@example.com",
      "user_id": "user-7"
    },
    "arguments": {
      "thread_id": "0191f7b4-3f2a-7c1d-9e88-2b6a5d4c3e90"
    },
    "command": "thread.close",
    "command_id": "0191f7b4-3f2a-7c1d-9e88-2b6a5d4c3e83"
  },
  "protocol_version": "1.0",
  "sequence": 21,
  "signature": "AAAAAAAAAAAAAAAAAAAAAAAAAAAAAAAAAAAAAAAAAAAAAAAAAAAAAAAAAAAAAAAAAAAAAAAAAAAAAAAAAAAAAA",
  "signer_key_id": "NYM5RLRJB6K2BD5REZ2WX75HDVULXAW5BAYJR6F3CLVOYDN37QZQ",
  "tenant_id": "acme",
  "trust_domain": "saas-attested",
  "workspace_id": "platform"
}
