{
  "correlation_id": "0191f7b4-3f2a-7c1d-9e88-2b6a5d4c3e01",
  "delegation_chain": [],
  "destination_conductor_id": "0191f7b4-3f2a-7c1d-9e88-2b6a5d4c3e93",
  "event_id": "0191f7b4-3f2a-7c1d-9e88-2b6a5d4c3f01",
  "event_type": "query.request",
  "occurred_at": "2026-07-26T12:00:40.000Z",
  "payload": {
    "as_of": {
      "event_id": "0191f7b4-3f2a-7c1d-9e88-2b6a5d4c3e12",
      "occurred_at": "2026-07-26T12:00:12.000Z"
    },
    "kind": "thread.history",
    "limit": 25,
    "offset": 25,
    "query_id": "0191f7b4-3f2a-7c1d-9e88-2b6a5d4c3f81",
    "thread_id": "0191f7b4-3f2a-7c1d-9e88-2b6a5d4c3e90"
  },
  "protocol_version": "1.5",
  "sequence": 40,
  "signature": "AAAAAAAAAAAAAAAAAAAAAAAAAAAAAAAAAAAAAAAAAAAAAAAAAAAAAAAAAAAAAAAAAAAAAAAAAAAAAAAAAAAAAA",
  "signer_key_id": "NYM5RLRJB6K2BD5REZ2WX75HDVULXAW5BAYJR6F3CLVOYDN37QZQ",
  "tenant_id": "acme",
  "trust_domain": "tenant",
  "workspace_id": "platform"
}
